{
  "$schema": "https://ui.shadcn.com/schema/registry-item.json",
  "name": "radio-group",
  "type": "registry:ui",
  "title": "Radio Group",
  "description": "Mutually exclusive choices with arrow-key selection and a visible label.",
  "dependencies": [
    "radix-ui"
  ],
  "registryDependencies": [
    "https://abackui.com/r/utils.json"
  ],
  "categories": [
    "Forms"
  ],
  "docs": "https://abackui.com/docs/components/radio-group",
  "meta": {
    "status": "beta"
  },
  "files": [
    {
      "path": "components/ui/radio-group.tsx",
      "content": "\"use client\";\n\nimport * as React from \"react\";\nimport { RadioGroup as RadioGroupPrimitive } from \"radix-ui\";\n\nimport { cn } from \"@/lib/utils\";\n\nfunction RadioGroup({\n  className,\n  ...props\n}: React.ComponentProps<typeof RadioGroupPrimitive.Root>) {\n  return (\n    <RadioGroupPrimitive.Root\n      data-slot=\"radio-group\"\n      className={cn(\"grid gap-2\", className)}\n      {...props}\n    />\n  );\n}\n\nfunction RadioGroupItem({\n  className,\n  ...props\n}: React.ComponentProps<typeof RadioGroupPrimitive.Item>) {\n  return (\n    <RadioGroupPrimitive.Item\n      data-slot=\"radio-group-item\"\n      className={cn(\n        \"peer size-4 shrink-0 border border-input bg-background outline-none transition-colors\",\n        \"hover:border-foreground/40\",\n        \"focus-visible:ring-2 focus-visible:ring-focus-ring focus-visible:ring-offset-2 focus-visible:ring-offset-background\",\n        \"disabled:cursor-not-allowed disabled:opacity-50\",\n        \"data-[state=checked]:border-primary data-[state=checked]:bg-primary\",\n        \"aria-invalid:border-destructive\",\n        className,\n      )}\n      {...props}\n    >\n      <RadioGroupPrimitive.Indicator\n        data-slot=\"radio-group-indicator\"\n        className=\"flex items-center justify-center\"\n      >\n        <span aria-hidden=\"true\" className=\"size-1.5 bg-primary-foreground\" />\n      </RadioGroupPrimitive.Indicator>\n    </RadioGroupPrimitive.Item>\n  );\n}\n\nexport { RadioGroup, RadioGroupItem };\n",
      "type": "registry:ui",
      "target": "components/ui/radio-group.tsx"
    }
  ]
}
