{
  "$schema": "https://ui.shadcn.com/schema/registry-item.json",
  "name": "switch",
  "type": "registry:ui",
  "title": "Switch",
  "description": "A binary toggle with switch semantics.",
  "dependencies": [
    "radix-ui"
  ],
  "registryDependencies": [
    "https://abackui.com/r/utils.json"
  ],
  "categories": [
    "Forms"
  ],
  "docs": "https://abackui.com/docs/components/switch",
  "meta": {
    "status": "stable",
    "usedIn": [
      "aback-tools",
      "aback-launch"
    ]
  },
  "files": [
    {
      "path": "components/ui/switch.tsx",
      "content": "\"use client\";\n\nimport * as React from \"react\";\nimport { Switch as SwitchPrimitive } from \"radix-ui\";\n\nimport { cn } from \"@/lib/utils\";\n\nfunction Switch({\n  className,\n  ...props\n}: React.ComponentProps<typeof SwitchPrimitive.Root>) {\n  return (\n    <SwitchPrimitive.Root\n      data-slot=\"switch\"\n      className={cn(\n        \"peer inline-flex h-5 w-9 shrink-0 cursor-pointer items-center border border-transparent bg-input p-0.5 outline-none transition-colors duration-200\",\n        \"focus-visible:ring-2 focus-visible:ring-focus-ring focus-visible:ring-offset-2 focus-visible:ring-offset-background\",\n        \"disabled:cursor-not-allowed disabled:opacity-50\",\n        \"data-[state=checked]:bg-primary\",\n        className,\n      )}\n      {...props}\n    >\n      <SwitchPrimitive.Thumb\n        data-slot=\"switch-thumb\"\n        className={cn(\n          \"pointer-events-none block size-4 bg-background shadow-xs transition-transform duration-200\",\n          \"data-[state=checked]:translate-x-4 data-[state=unchecked]:translate-x-0\",\n        )}\n      />\n    </SwitchPrimitive.Root>\n  );\n}\n\nexport { Switch };\n",
      "type": "registry:ui",
      "target": "components/ui/switch.tsx"
    }
  ]
}
