{
  "$schema": "https://abackui.com/schema/registry-item.json",
  "name": "input",
  "type": "registry:ui",
  "title": "Input",
  "description": "A single-line text control aligned to the 36px control grid.",
  "registryDependencies": [
    "https://abackui.com/r/utils.json"
  ],
  "categories": [
    "Forms"
  ],
  "docs": "https://abackui.com/docs/components/input",
  "meta": {
    "status": "stable",
    "usedIn": [
      "aback-tools",
      "aback-launch"
    ]
  },
  "files": [
    {
      "path": "components/ui/input.tsx",
      "content": "import * as React from \"react\";\n\nimport { cn } from \"@/lib/utils\";\n\nconst inputClassName = [\n  \"flex h-9 w-full min-w-0 border border-input bg-transparent px-3 py-1 text-sm text-foreground shadow-xs\",\n  \"outline-none transition-[color,background-color,border-color,box-shadow] duration-200\",\n  \"placeholder:text-muted-foreground\",\n  \"file:inline-flex file:h-7 file:border-0 file:bg-transparent file:text-sm file:font-medium file:text-foreground\",\n  \"focus-visible:border-ring focus-visible:ring-2 focus-visible:ring-focus-ring focus-visible:ring-offset-2 focus-visible:ring-offset-background\",\n  \"disabled:cursor-not-allowed disabled:opacity-50\",\n  \"aria-invalid:border-destructive aria-invalid:ring-destructive/20\",\n  \"dark:bg-input/30\",\n].join(\" \");\n\nconst Input = React.forwardRef<HTMLInputElement, React.ComponentProps<\"input\">>(\n  function Input({ className, type, ...props }, ref) {\n    return (\n      <input\n        ref={ref}\n        type={type}\n        data-slot=\"input\"\n        className={cn(inputClassName, className)}\n        {...props}\n      />\n    );\n  },\n);\nInput.displayName = \"Input\";\n\nexport { Input, inputClassName };\n",
      "type": "registry:ui",
      "target": "components/ui/input.tsx"
    }
  ]
}
